url,metadata
https://www.youtube.com/watch?v=jOBeQOz1Hzw,Practical objections against helping wild animals
https://www.youtube.com/watch?v=UOQNclA8JyU,Responses to criticisms to the ethics of helping animals
https://www.youtube.com/watch?v=2ckXcsGeosY,Welfare biology and other cross disciplinary fields
https://www.youtube.com/watch?v=_cf9ZjA9WLY,Promising areas for welfare biology research
https://www.youtube.com/watch?v=uJz8K-1P8kE,Reasons for promoting welfare biology as an academic field
https://www.youtube.com/watch?v=0_iuP-f1Kr4,What is welfare biology?
https://www.youtube.com/watch?v=ip3N0KljEe8,"The concepts of welfare, animal welfare, and wild animal welfare"
https://www.youtube.com/watch?v=A4yOxBnGXiY,Invertebrate sentience
https://www.youtube.com/watch?v=Al5zRjvT2gE,What is sentience?
https://www.youtube.com/watch?v=AzFwOnYPV9U,Animal ethics and environmental ethics
https://www.youtube.com/watch?v=WsXzdi7zSOo,Ethical theories and nonhuman animals
https://www.youtube.com/watch?v=x9SRzDMuJPc,Arguments against speciesism II
https://www.youtube.com/watch?v=luy5jsENuA0,Arguments against speciesism I
https://www.youtube.com/watch?v=dPOtLC9ffqk,"Speciesism, moral consideration and anthropocentrism"
https://www.youtube.com/watch?v=p0p_6gWj6ls,What you can do
https://www.youtube.com/watch?v=igRsqpOJP7U,Vaccinating animals in the wild
https://www.youtube.com/watch?v=1dl_eHonR0w,Various ways to help wild animals in need
https://www.youtube.com/watch?v=86s68fqZm6g,Rescuing animals
https://www.youtube.com/watch?v=6hFL5hPsrEU,Reproductive strategies and animal suffering
https://www.youtube.com/watch?v=bkiWh9BGPcU,Injuries due to accidents
https://www.youtube.com/watch?v=H5iTSc5zOhQ,Conflicts between animals
https://www.youtube.com/watch?v=Jstp2-f4eFw,"Hunger, thirst and psychological stress"
https://www.youtube.com/watch?v=KCfjRhLGhI4,Diseases and parasitism
https://www.youtube.com/watch?v=XJNPuj-qhrI,Weather conditions and natural disasters
https://www.youtube.com/watch?v=OYJi9zLBjaI,What is wild animal suffering?
https://www.youtube.com/watch?v=1Dp6gObE9eA,Wild animal suffering: an introduction
https://www.youtube.com/watch?v=cid7idodEPE,Wild animal suffering: an overview of the course
https://www.youtube.com/watch?v=t6qduUTfHoQ,Pampered Pets
https://www.youtube.com/watch?v=ztJmUN_3v7g,Animal Charity Evaluators
https://www.youtube.com/watch?v=PCH5Es9Avqg,Why farmed animals? Cause prioritization explained.
https://www.youtube.com/watch?v=5_nlTu4l_ZA,ACE Webinar: Research and Strategy for Effective Animal Advocacy
https://www.youtube.com/watch?v=T29U7b21r4Y,Jon Bockman AR2014
https://www.youtube.com/watch?v=jMm0dIIM4u4,2016 EAA Symposium - State of the Movement
https://www.youtube.com/watch?v=ICKxhc5VOr8,2016 EAA Symposium - Advocacy Through Education
https://www.youtube.com/watch?v=p7P-zEMirHU,2016 EAA Symposium - Psychology
https://www.youtube.com/watch?v=0QTUjMvJj94,2016 EAA Symposium - Keynote Address
https://www.youtube.com/watch?v=3cBujX2I8CY,2016 EAA Symposium - Utilizing Research
https://www.youtube.com/watch?v=up2UeQxaOv0,2016 EAA Symposium - Introduction
https://www.youtube.com/watch?v=nd3SQSiYOnM,2016 EAA Symposium - Broadening Horizons
https://www.youtube.com/watch?v=OnyHyXCT0j0,2016 EAA Symposium - Innovative Techniques
https://www.youtube.com/watch?v=yaH0l4Hys3k,2016 EAA Symposium - Advocacy Techniques
https://www.youtube.com/watch?v=Nm7Qonn_e7U,2016 EAA Symposium - Cognitive Science
https://www.youtube.com/watch?v=QHkLJwY3cj4,Longtermism in Animal Advocacy
https://www.youtube.com/watch?v=1p8yXoJLQF0,ACE Community Chat: Movement Grants Q&A
https://www.youtube.com/watch?v=ZlRGhh4wfuA,ACE Community Chat: Animal Advocacy Research
https://www.youtube.com/watch?v=s48cbJS4m5g,EAA Fund Grantees Updates: The Raven Corps
https://www.youtube.com/watch?v=orf4s-8e4UQ,EAA Fund Grantees Updates: Vegetarianos Hoy
https://www.youtube.com/watch?v=fZDoGE85WaY,EAA Fund Grantees Updates: Factory Farming Awareness Coalition
https://www.youtube.com/watch?v=GvBFJ9ci2FE,EAA Fund Grantees Updates: Health Save Movement
https://www.youtube.com/watch?v=uCFNfcYhLuw,EAA Fund Grantees Updates: Animal Justice Project
https://www.youtube.com/watch?v=huFmmNB8LM4,EAA Fund Grantees Updates: Sneha's Care
https://www.youtube.com/watch?v=KqoP5lIS19s,EAA Fund Grantees Updates: Animal Welfare Media
https://www.youtube.com/watch?v=wMb26ryjDuU,Peter Singer - Would you save a drowning child?
https://www.youtube.com/watch?v=P0L27a1vH1Y,Make an Impact - Save a Child's Life
https://www.youtube.com/watch?v=2Y3TTVK8wGQ,I Want To Do Good!
https://www.youtube.com/watch?v=xnXu9y0YxAQ,You Don't Have to be Brave to Save Lives: Charlie Bresler The Life You Can Save's Executive Director
https://www.youtube.com/watch?v=HovXq2Ak6VU,"An Interview with Charlie Bresler, Executive Director of The Life You Can Save"
https://www.youtube.com/watch?v=Ochib6yZca8,True stories of lives changed: The Life You Can Save
https://www.youtube.com/watch?v=-FFK5MLZaOI,World NGO Day | 27th February 2021
https://www.youtube.com/watch?v=2MilQmlxh6I,A Realistic Standard - Peter Singer
https://www.youtube.com/watch?v=D50aLhF6Km4,Make an Impact - Provide clean water & improve sanitation
https://www.youtube.com/watch?v=k5uf_zexwCg,Make an Impact - Protect people against Malaria
https://www.youtube.com/watch?v=P02cHkqO-NQ,Iodine Deficiency Disorder
https://www.youtube.com/watch?v=l2djcZqPEJE,Make An Impact - Create Economic Opportunity
https://www.youtube.com/watch?v=W_Bh_HxYTD8,"Emerging Challenges for the Post-Covid Era: Addressing Opportunity, Inequality, and Growth"
https://www.youtube.com/watch?v=OQhIEUaXRVY,Lab de l’Emploi au Maroc
https://www.youtube.com/watch?v=7W_ZVbCAdQc,Covid Dialogues: Addressing Education Challenges during Covid-19
https://www.youtube.com/watch?v=uMBplanjqVY,Building State Capacity for Tax Collection: Emerging Evidence and Implications for Practice webinar
https://www.youtube.com/watch?v=8t4XNcUkjzE,Using phone surveys to improve public service delivery and guide crisis response—Insights
https://www.youtube.com/watch?v=upKoYUVB-Zc,J-PAL Africa Evidence Innovation Summit: Teaching at the Right Level
https://www.youtube.com/watch?v=e17O3lI4uiA,J-PAL Africa Evidence Innovation Summit: Informing Policy during Covid-19
https://www.youtube.com/watch?v=WVK11WSe-8Y,J-PAL Africa @ 10: Testimonial from Moitshepi Matsheng
https://www.youtube.com/watch?v=i2Soa2fLBOY,HCDI at 8: Strategies to Reduce Racial Disparities in Health Outcomes
https://www.youtube.com/watch?v=y58XOw82dPE,HCDI at 8: Addressing Social Determinants of Health through Research Partnerships
https://www.youtube.com/watch?v=YijXX3DOVAg,HCDI at 8: Implementing RCTs in Large Health Systems
https://www.youtube.com/watch?v=IP08v9cqt08,"Mobile Money: Impacts, Challenges and Open Questions"
https://www.youtube.com/watch?v=0tUJP9Vzvtg,HCDI at 8: Using Randomized Evaluations to Answer Open Questions in Health Care Policy
https://www.youtube.com/watch?v=7Fuh5_PlgnE,HCDI at 8: Welcome Remarks
https://www.youtube.com/watch?v=1K46dbjsvJc,Morocco Employment Lab
https://www.youtube.com/watch?v=m9GDYK8MT2I,Covid Dialogues: Cash Grants to Support Female Entrepreneurs
https://www.youtube.com/watch?v=jRV26EwiD00,Who Delivers Justice? Evidence for Strengthening Dispute Resolution Systems
https://www.youtube.com/watch?v=8k-1vO1sxvk,Impact Evaluation of the Transition from Rastra to BPNT: Preliminary Findings
https://www.youtube.com/watch?v=tIiEgXXI0BE,Celebrating Earth Day: Catalyzing evidence-informed action at the nexus of poverty & climate change
https://www.youtube.com/watch?v=BBnxZ452_TE,Impact Evaluation of the Transition from Rastra to BPNT
https://www.youtube.com/watch?v=VbZvt1g-PpU,Combating Violence Against Women through State Institutions
https://www.youtube.com/watch?v=sHp4aSXKtjs,"J-PAL Executive Education: Evaluation Social Programs, US 2021"
https://www.youtube.com/watch?v=TPGSxO2PexQ,IDEA Webinar: Physically Protecting Sensitive Data
https://www.youtube.com/watch?v=JLNxgfzwKww,Global Evidence for Egypt Spotlight Seminar: Social Norms and Gender
https://www.youtube.com/watch?v=KWMHnrcM4d8,IDEA Webinar: Using Administrative Data to Improve Social Protection in Indonesia
https://www.youtube.com/watch?v=SWJjsvayw-0,State and Local Innovation Competition Information Session
https://www.youtube.com/watch?v=EYyetBFDeLk,Innovations in Data and Experiments for Action Initiative: Social Assistance in Indonesia
https://www.youtube.com/watch?v=kphB9ClPfM8,J-PAL's Jobs and Opportunity Initiative
https://www.youtube.com/watch?v=cOu-sTV8J2M,IDEA Webinar: Designing Access with Differential Privacy
https://www.youtube.com/watch?v=7kU7V_H0nyQ,J-PAL Covid Dialogues: Supporting Working Women During Covid-19
https://www.youtube.com/watch?v=qnxpvVHWXvA,J-PAL Afrique: Appui à la Création de Politiques Publiques et de Programmes
https://www.youtube.com/watch?v=1Z1sx5e7fGA,J-PAL Africa: Policy and Program Support
https://www.youtube.com/watch?v=jYBg-p94gHQ,"IDEA Webinar: New Brunswick Institute for Research, Data and Training"
https://www.youtube.com/watch?v=tTuayub1iRo,"IDEA Webinar: Institute for Employment Research, Germany"
https://www.youtube.com/watch?v=RBWzR4FC20w,IDEA Webinar: Development Impact Evaluation
https://www.youtube.com/watch?v=Pl1QvLMBdLg,IDEA Webinar: Aurora Health Care
https://www.youtube.com/watch?v=VLQtkwQyQvo,IDEA Webinar: Institutional Review Boards
https://www.youtube.com/watch?v=GK-N-SN3BrY,IDEA Webinar: Disclosure Avoidance Methods
https://www.youtube.com/watch?v=zzJy6ECdd80,IDEA Webinar: Data Use Agreements
https://www.youtube.com/watch?v=qYfwWLZaxxQ,IDEA Webinar: Stanford-SFUSD Partnership
https://www.youtube.com/watch?v=ZtLndEL28lM,IDEA Webinar: Ohio Longitudinal Data Archive
https://www.youtube.com/watch?v=S_nsnfTjPMY,Towards Inclusive Digital Finance in Indonesia
https://www.youtube.com/watch?v=Ksh0z6VsAo8,Responding to the COVID-19 Pandemic: Improving Health Equity with Lessons from Research
https://www.youtube.com/watch?v=NKiHz8eSJXI,IDEA Webinar: City of Cape Town
https://www.youtube.com/watch?v=IZW2vz4Bp3k,Evaluations and Racial Equity: Considerations for State and Local Policymakers and Researchers
https://www.youtube.com/watch?v=fViGcbJ9irw,Global Evidence for Egypt Spotlight Webinar on Social Assistance
https://www.youtube.com/watch?v=P3TprS5PrGw,State and Local Policy Responses to Climate Change
https://www.youtube.com/watch?v=RuWfmj1iH-k,Incorporating qualitative research and interdisciplinary perspectives in randomized evaluations
https://www.youtube.com/watch?v=XKJVWf1bhqA,"1,000 Evaluations: Behind the scenes with J‑PAL research staff"
https://www.youtube.com/watch?v=k7f_ZbMiodE,Launching gLOCAL Evaluation Week 2020 in South Asia
https://www.youtube.com/watch?v=QpvsNrtrpS4,Iqbal Dhaliwal: A journey from evidence to scale
https://www.youtube.com/watch?v=X2EJ0DEZcJk,Evidence to Policy: Individualized tutoring to improve learning
https://www.youtube.com/watch?v=ZMe_YU18BOI,Adaptations for phone surveys: A webinar with Tavneet Suri
https://www.youtube.com/watch?v=2wJ4TkL4fpM,About J-PAL North America
https://www.youtube.com/watch?v=m1JsYrjFupc,Unpacking the Evidence: Rebecca Dizon-Ross
https://www.youtube.com/watch?v=cH_gFctyeIg,Unpacking the Evidence: Oriana Bandiera
https://www.youtube.com/watch?v=t24AXXdrC-w,Unpacking the Evidence: Seema Jayachandran
https://www.youtube.com/watch?v=jxObU3nalYQ,Unpacking the Evidence: Lorenzo Casaburi
https://www.youtube.com/watch?v=AseMjkCODmA,Reducing Housing Instability with Randomized Evaluations
https://www.youtube.com/watch?v=AiRYrMr7NEY,Catalyzing scale-ups: Changing lives through evidence
https://www.youtube.com/watch?v=Lk8oOT6XycE,Generalizability: Can results from one context be applied to another?
https://www.youtube.com/watch?v=gAATYORoJMw,Good Economics for Hard Times Launch Conference - Harvard University
https://www.youtube.com/watch?v=_MvE7GVrOLc,Seema Jaychandran: Thinking Globally to Mitigate Climate Change
https://www.youtube.com/watch?v=GNGFqJeIzLw,Evidence to Policy: Teaching at the Right Level to Improve Learning
https://www.youtube.com/watch?v=OCDMu6k5zy4,Professional Development at J-PAL Global
https://www.youtube.com/watch?v=GWX78stRxT8,Who is J-PAL?
https://www.youtube.com/watch?v=2wY97EWRJjM,Workplace Culture at J-PAL Global
https://www.youtube.com/watch?v=oQ_MVcHnoNE,gLOCAL Evaluation Week: Using Evidence for Achieving Quality Health
https://www.youtube.com/watch?v=SZalcKK-nu4,"Roberto Rigobon | Venezuela: How did we get here, and what's next?"
https://www.youtube.com/watch?v=xTWlSNLNl_Y,Paul Niehaus: Giving away money to people living in extreme poverty
https://www.youtube.com/watch?v=28e3Em8QDRI,MicroMasters® Program in DEDP | Learner Testimonial: Olive Mutai
https://www.youtube.com/watch?v=bPHdMP2AGdk,From RA to Implementer: Noam Angrist ‘13 on co-founding Young 1ove
https://www.youtube.com/watch?v=3w_xja2Bkpg,Measurement and Survey Design - Participant Testimonial
https://www.youtube.com/watch?v=V6nSi7WDI8E,"About the Abdul Latif Jameel Poverty Action Lab (J-PAL), in partnership with Community Jameel"
https://www.youtube.com/watch?v=qJUkpPF0bZU,What's it like to work at J-PAL South Asia?
https://www.youtube.com/watch?v=xWR5MSk7nj8,J-PAL North America Education Technology Competition Webinar
https://www.youtube.com/watch?v=025Q8ibB-yg,MicroMasters® Program in DEDP | Learner Testimonial: Stephen Shisoka Okiya
https://www.youtube.com/watch?v=K55VluvSsAk,"DoPT: MicroMasters in Data, Development, and Economic Policy"
https://www.youtube.com/watch?v=v2-y7tOhUl0,Michael Greenstone: A Big Data Revolution in Assessing Climate Risk
https://www.youtube.com/watch?v=O5Uu3i8qWHY,Dan Levy Why Randomize
https://www.youtube.com/watch?v=UYlDHIs8V24,Joe Doyle: How to Randomize
https://www.youtube.com/watch?v=aNbabnONlY4,Rachel Glennerster: Sampling and Sample Size
https://www.youtube.com/watch?v=8A5UNc4Py84,Don Green: Threats and Analysis
https://www.youtube.com/watch?v=p15Gf2Vyg0g,Rachel Glennerster: Generalizability
https://www.youtube.com/watch?v=oDMBZcy5QIQ,"Kelsey Jack: Outcomes, Impacts, and Indicators"
https://www.youtube.com/watch?v=6e3eX8Ly6xc,Marc Shotland: What is Evaluation
https://www.youtube.com/watch?v=9FYpJnMEcF0,South Asia Research for Impact Fellowship
https://www.youtube.com/watch?v=njKFeIw9CX8,Panel 1: Governance and Conflict in Fragile States
https://www.youtube.com/watch?v=E2qd9MA2qtk,Introductory remarks
https://www.youtube.com/watch?v=4pPdXvcZFuc,Panel 2: The Politics of Reducing Corruption
https://www.youtube.com/watch?v=t0RQAPSMiwY,Working at J-PAL Global: Research Associate
https://www.youtube.com/watch?v=LNSmK1VNJ2I,Reducing adolescent pregnancy
https://www.youtube.com/watch?v=VgMiceVkrHE,Working at J-PAL Africa
https://www.youtube.com/watch?v=A38jpnZzrcs,Elie Hassenfeld: Making Donor Dollars Count
https://www.youtube.com/watch?v=i0kElXmoxwk,J-PAL South Asia @ 10
https://www.youtube.com/watch?v=1Y_ik69zQ1E,"J-PAL Education, Technology, and Opportunity Innovation Competition Webinar 2018"
https://www.youtube.com/watch?v=71tpL_bNJEI,"Closing Remarks: Mary Ann Bates, J-PAL North America"
https://www.youtube.com/watch?v=A9NXIfYQSo4,Bringing It Home: Evidence-Informed Decision Making
https://www.youtube.com/watch?v=dYOsUX-qC5I,Building Bridges: Cross-Sector Partnerships for Data-Driven Policy
https://www.youtube.com/watch?v=PBPB8nLUy2Y,Partnering for Policy: Government-Research Partnerships
https://www.youtube.com/watch?v=xLcmJBTm-Zc,Welcome Address: Joseph Simitian (Santa Clara County Supervisor)
https://www.youtube.com/watch?v=hYkS7HtvSSA,Opening Remarks: Mary Ann Bates (J-PAL North America)
https://www.youtube.com/watch?v=VXlots8YAbY,Keynote Address: Linda Gibbs (Bloomberg Associates and Results for America)
https://www.youtube.com/watch?v=yozJJ5pDazU,Webinar session 17: Innovative uses of Administrative Data
https://www.youtube.com/watch?v=6g54-ZtSNrU,J-PAL Health Care Delivery Innovation Competition Webinar 2018
https://www.youtube.com/watch?v=yPBz_N8G8gg,J-PAL State and Local Innovation Initiative Webinar 2018
https://www.youtube.com/watch?v=u3vFs0Mi5_8,Abhijit Banerjee Keynote / J-PAL South Asia @ 10
https://www.youtube.com/watch?v=d4ANHlJAXz8,"Abhijit Banerjee, S. Krishnan, and Madhav Chavan Panel Discussion / J-PAL South Asia @ 10"
https://www.youtube.com/watch?v=s56TRWLBkzQ,Pascaline Dupas: Design and Effectiveness of Public Health Subsidies in Less Developed Countries
https://www.youtube.com/watch?v=ukQ2pma4Hyw,J-PAL South Asia @ 10
https://www.youtube.com/watch?v=YFDw_rSqxdQ,Abhijit Banerjee: Reducing Poverty and Promoting Social Development
https://www.youtube.com/watch?v=8AKmQAMFXGI,Scaling Evidence-based Innovations in Education with Government Partners
https://www.youtube.com/watch?v=jntgRHYVLDo,When Do Innovation and Evidence Change Lives?
https://www.youtube.com/watch?v=ybIt7nxhUAw,Marianne Bertrand: Coming Apart? Lives of the Rich and Poor Over Time in the United States
https://www.youtube.com/watch?v=jVQxB6wHKts,Building Networks and Taking on Complex Challenges in Education | Karen Cator and Quentin Palfrey
https://www.youtube.com/watch?v=iFfN6OwBFJI,Testing and Improving Edtech Policies | Karen Cator and Quentin Palfrey
https://www.youtube.com/watch?v=1tIdVPfabYA,The Future of Libraries | Karen Cator and Quentin Palfrey
https://www.youtube.com/watch?v=ct96Lyx8npM,Using Edtech to Close Equality Gaps | Karen Cator and Quentin Palfrey
https://www.youtube.com/watch?v=OQEJrBhvOWQ,David Autor: The China Shock
https://www.youtube.com/watch?v=8DzbJYmiZyQ,"Research & Innovation: Ed-Tech, Personalized Learning and the Digital Divide - Quentin Palfrey"
https://www.youtube.com/watch?v=Pxpj_FQ22v8,Closing Remarks: Rachel Glennerster
https://www.youtube.com/watch?v=VGPU39-miDw,Perspectives on Personalized Learning and the Power of Rigorous Research: Panel Discussion
https://www.youtube.com/watch?v=WXy0-EuHLZ4,RCTs in Education - When and How to Use Them: Panel Discussion
https://www.youtube.com/watch?v=yfmqhv1x51c,Improving Access to Education in the 21st Century: Panel Discussion
https://www.youtube.com/watch?v=1PLXQX06WMQ,Defining the Landscape of Education Technology Policy: Kumar Garg
https://www.youtube.com/watch?v=RnkA0uq3aHI,How Data and Evidence can Transform Education: Aneesh Chopra
https://www.youtube.com/watch?v=PEpKJkiYAKA,Current Evidence on the Impact of Education Technology: Phil Oreopoulos
https://www.youtube.com/watch?v=tk-JJXWPd2Y,Abhijit Banerjee: Demonetizing India
https://www.youtube.com/watch?v=U-SOVNcsUfI,Webinar session 16: Implementation Science
https://www.youtube.com/watch?v=es3CTDhyY5M,Webinar session 15: Bridging the Quantitative-Qualitative Divide
https://www.youtube.com/watch?v=693YZetmIcc,Blending Research and Innovation to Transform Student Learning: Keynote by Karen Cator
https://www.youtube.com/watch?v=8hWoreMT6gE,Using Identification Cards to Improve National Social Assistance in Indonesia
https://www.youtube.com/watch?v=D0RenN8q_NI,"Shifting Opinions, Changing Practices"
https://www.youtube.com/watch?v=IU01Ga5EsJM,Enhancing Delivery through Financial Reform of MGNREGS
https://www.youtube.com/watch?v=Uxqw2Pgm7s8,Why Randomize?
https://www.youtube.com/watch?v=s-rX47-ECsA,Using Rigorous Evaluation to Improve Outcomes for Mothers and Children: Katherine Baicker
https://www.youtube.com/watch?v=-zhEl4R8fic,Evidence in Practice: Mary Ann Bates
https://www.youtube.com/watch?v=gE9-V85YEpw,The Power of Evidence in Crime and Violence Prevention: Evelyn Diaz and Sara Heller
https://www.youtube.com/watch?v=6j7XvajxKCY,The Power of Evidence in Crime and Violence Prevention: Ben Fulton
https://www.youtube.com/watch?v=kxUY37bqPD0,The Power of Evidence in Crime and Violence Prevention: Maia Jachimowicz
https://www.youtube.com/watch?v=iHti9Z9WBWE,The Power of Evidence in Crime and Violence Prevention: Panel Q&A
https://www.youtube.com/watch?v=A1PMjbdZbS0,"Using Rigorous Evaluation to Improve Outcomes for Mothers and Children, Jeff Liebman"
https://www.youtube.com/watch?v=j9noY1iGeOM,Using Rigorous Evaluation to Improve Outcomes for Mothers and Children: Josh McGee
https://www.youtube.com/watch?v=7JKl2AvJhbI,Using Rigorous Evaluation to Improve Outcomes for Mothers and Children: Panel Q&A
https://www.youtube.com/watch?v=vvaH1tUF4UA,Using Rigorous Evaluation to Improve Outcomes for Mothers and Children: Christian Soura
https://www.youtube.com/watch?v=RltM60B6m54,Developing and Evaluating Interventions to Improve Housing Mobility: Larry Katz & Greg Russ
https://www.youtube.com/watch?v=c1XN2-V4TEo,Developing and Evaluating Interventions to Improve Housing Mobility: Panel Q&A
https://www.youtube.com/watch?v=4nGZ0eujpD0,Building Partnerships to Promote Evidence-Based Policy: Quentin Palfrey
https://www.youtube.com/watch?v=JgCSp7j5bw8,Working at J-PAL Global: Policy Associate
https://www.youtube.com/watch?v=xxAtKVm0AS8,Working at J-PAL Global: Policy Manager
https://www.youtube.com/watch?v=C3F2111udeg,Working at J-PAL Global: Senior Policy Associate
https://www.youtube.com/watch?v=eTzX2lcIlE4,Recruitment Webinar Recording
https://www.youtube.com/watch?v=mf_DxuuVTQA,Will It Really Work? Applying Evidence at Scale in Health Care Delivery: Dr. Atul Gawande Pt. 2
https://www.youtube.com/watch?v=n_E1pg1kphU,Will It Really Work? Applying Evidence at Scale in Health Care Delivery: Dr. Atul Gawande Pt. 1
https://www.youtube.com/watch?v=poQXj8Fekkc,"Evaluating Innovative Programs for Low-income, First-time Mothers: Tamar Bauer, NFP"
https://www.youtube.com/watch?v=wni81d6pSYc,J PAL State and Local Innovation Initiative Webinar - December 8 2016
https://www.youtube.com/watch?v=hSjXUjeuH9I,"Evaluating Innovative Programs for High-need Patients: Joseph Doyle, MIT"
https://www.youtube.com/watch?v=mjJvrdWM54Y,"Evaluating Innovative Programs for Low-income, First-time Mothers: Katherine Baicker, Harvard"
https://www.youtube.com/watch?v=WS_eq4Zyp1Q,"Evaluating Innovative Programs for High-need Patients and Low-income, First-time Mothers: Panel"
https://www.youtube.com/watch?v=-xLxH-504VA,"Randomized Evaluations in US Health Care Delivery: Amy Finkelstein, MIT"
https://www.youtube.com/watch?v=bxIVEwMDnkY,"Engaging the Uninsured and Demystifying Health Insurance Decisions: Wesley Yin, UCLA"
https://www.youtube.com/watch?v=JUlt2M6VdRA,"The Role of Evidence in a New Era of Health Care Policy: Katherine Hempstead, RWJF"
https://www.youtube.com/watch?v=SHUYet3fdTg,"The Power of Evidence in Reforming US Health Care: Ashish Jha, Harvard"
https://www.youtube.com/watch?v=-814Ta_3zsY,"A Primer on Evaluating Health and Other Social Programs: Rohit Naimpally, J-PAL North America"
https://www.youtube.com/watch?v=qJBdF2-7K2k,"Engaging Hard to Reach Patients: Monteic Sizer, Northeast Delta Human Services Authority"
https://www.youtube.com/watch?v=ZN-wCdlU_q4,"Increasing Service Engagement among People with Complex Needs: Caterina Hill, CCA"
https://www.youtube.com/watch?v=JSdLGrwZef0,"Improving Social Determinants of Health: Rose Englert, CareOregon"
https://www.youtube.com/watch?v=s2weur3FuYE,Addressing Key Challenges in Public Health: Panel
https://www.youtube.com/watch?v=NdTxBAYhNZw,"Substance Abuse and the Criminal Justice System: Steve Durham, Louisville Metro"
https://www.youtube.com/watch?v=foQ88V3dYGw,"A Vision for Evidence-Informed Policy: Quentin Palfrey, J-PAL North America"
https://www.youtube.com/watch?v=-tUVJ4I2ywQ,Donald Green: The Science (and Pseudoscience) of Elections
https://www.youtube.com/watch?v=Egc42zYDTvo,Donald Green: Evidence-informed ways to raise voter turnout
https://www.youtube.com/watch?v=RyFqQwpKiaU,Research Transparency and Reproducibility
https://www.youtube.com/watch?v=J5Qb4dHP8mw,Rukmini Banerji: Measurement for Action
https://www.youtube.com/watch?v=d_JIlpF5WcI,Sendhil Mullainathan: The Psychological Lives of the Poor
https://www.youtube.com/watch?v=feKCFYQlm-4,"J-PAL Health Care Delivery Innovation Competition Webinar - May 19, 2016"
https://www.youtube.com/watch?v=9GsYZhrRSQY,"J-PAL Health Care Delivery Innovation Competition Webinar - April 15, 2016"
https://www.youtube.com/watch?v=5Sw06wrpwbs,"J-PAL State and Local Innovation Initiative Webinar - January 11, 2016"
https://www.youtube.com/watch?v=AF7wN75hIXw,"J-PAL State and Local Innovation Initiative Webinar - December 9, 2015"
https://www.youtube.com/watch?v=Ritr1OHdWSg,Sierra Leone 2012 Parliamentary Election Debate
https://www.youtube.com/watch?v=CxAUmhmF7Mw,Webinar session 14: Gender and Vulnerability
https://www.youtube.com/watch?v=PjqQAs_n6Lw,Iqbal Dhaliwal / What If Evidence Drove Policy...And Your Strategy?
https://www.youtube.com/watch?v=ncPpKH7E7T8,Webinar session 13: What can we learn from evaluations?
https://www.youtube.com/watch?v=DX2NMm1_dm4,Financial Services for the Poor: Lessons from the Latest Research on Credit
https://www.youtube.com/watch?v=bx0tK_N8BTM,"Remedial Education in Ghana, part 3 of 3 / J-PAL Webinar Series"
https://www.youtube.com/watch?v=yklu1J7d04I,"Remedial Education in Ghana, part 1 of 3 / J-PAL Webinar Series"
https://www.youtube.com/watch?v=B7f_icwc3IA,"Remedial Education in Ghana, part 2 of 3 / J-PAL Webinar Series"
https://www.youtube.com/watch?v=YzxcQec5Qrg,"Webinar session 12: Qualitatively Measuring ""Women's Empowerment"" / Part 3 of 3"
https://www.youtube.com/watch?v=zCHjdvGbf2U,"Webinar session 12: Qualitatively Measuring ""Women's Empowerment"" / Part 2 of 3"
https://www.youtube.com/watch?v=ZJoTm-JnV9g,"Webinar session 12: Qualitatively Measuring ""Women's Empowerment"" / Part 1 of 3"
https://www.youtube.com/watch?v=DWWx2h-b3v4,Digging For Answers: Examining the Effects of Rainfall Index Insurance for Farmers in Ghana
https://www.youtube.com/watch?v=IRKzi3cHwZs,"Webinar session 11: Gender, Evaluation, and Empowerment - Empowering Adolescent Girls / Part 4 of 4"
